{
  "$schema": "../schema/relation-record-v1.schema.json",
  "ontology_schema_version": "1.0.0",
  "source": "productivity.malmquist.decomposition.ray_desli",
  "target": "productivity.malmquist.adjacent_geometric",
  "type": "shares_compiler",
  "equivalence_level": null,
  "difference_axes": [
    "technology",
    "evaluation_protocol",
    "analysis"
  ],
  "conditions": [
    {
      "profile": "condition.ray_desli.shared_crs_malmquist_headline",
      "arguments": {
        "orientation": "output",
        "panel_pair": "same_balanced_dmu_and_same_adjacent_periods",
        "data_roles": "same_strictly_positive_productive_inputs_and_single_desirable_output",
        "shared_headline_technology": "four_crs_contemporaneous_distance_tasks",
        "shared_headline_operator": "adjacent_geometric_malmquist",
        "additional_ray_desli_tasks": "four_vrs_contemporaneous_distance_tasks",
        "additional_ray_desli_analysis": "pure_efficiency_change_times_vrs_technical_change_times_ray_desli_scale_change",
        "partial_failure_contract": "vrs_cross_infeasibility_preserves_valid_crs_headline_and_own_period_pure_efficiency",
        "alias_claim": "forbidden"
      }
    }
  ],
  "evidence": {
    "status": "primary_checked",
    "sources": [
      "doi:10.2307/2117971",
      "jstor:2951340"
    ],
    "proof_obligations": [
      "parameter_domain",
      "regression_test"
    ],
    "tests": [
      "tests/test_ray_desli_productivity.py::test_public_ray_desli_matches_independent_eight_task_source_oracle",
      "tests/test_ray_desli_productivity.py::test_existing_fgnz_and_generic_crs_contracts_remain_numerically_identical",
      "tests/test_ray_desli_productivity.py::test_vrs_cross_infeasibility_keeps_source_defined_partial_account"
    ]
  }
}
