{
  "$schema": "../schema/relation-record-v1.schema.json",
  "ontology_schema_version": "1.0.0",
  "source": "network.additive.chen_etal_2009",
  "target": "network.additive.cook_zhu_bi_yang_2010",
  "type": "exact_reduction",
  "equivalence_level": null,
  "difference_axes": [
    "graph",
    "technology",
    "evaluation_protocol",
    "analysis"
  ],
  "conditions": [
    {
      "profile": "condition.matched_closed_crs_two_stage_graph",
      "arguments": {
        "returns_to_scale": "crs",
        "external_inputs": "stage_one_only",
        "external_outputs": "stage_two_only",
        "link_multiplier": "shared",
        "minimum_process_share": 0.0,
        "comparison_population": "matched",
        "claim_scope": "primary_system_score_programme"
      }
    }
  ],
  "evidence": {
    "status": "primary_checked",
    "sources": [
      "doi:10.1016/j.ejor.2008.05.011",
      "doi:10.1016/j.ejor.2010.05.006"
    ],
    "proof_obligations": [
      "feasible_set",
      "objective_or_exact_value_transform",
      "parameter_domain",
      "regression_test"
    ],
    "tests": [
      "tests/test_cook_general_additive.py"
    ]
  }
}
